name,main_category,sub_category,image,link,ratings,no_of_ratings,discount_price,actual_price
"MG SALESS Forest, Outdoor, Picnic - Camping Portable Waterproof Tent for 4 Person/Camping Dome Tents with Multi-Colours",bags & luggage,Backpacks,https://m.media-amazon.com/images/I/71bxIHCOqKL._AC_UL320_.jpg,https://www.amazon.in/MG-SALESS-Forest-Outdoor-Picnic/dp/B084YSJ51C/ref=sr_1_6609?qid=1679218590&s=luggage&sr=1-6609,,,"₹1,999","₹3,599"
"Venja Waterproof Dry Bag Sack, 20 Liter Camping Swimming Bag, Trekking/Boating/Rafting Storage Bag Organizer (Multicolor)",bags & luggage,Backpacks,https://m.media-amazon.com/images/I/61ZcGE5ov8L._AC_UL320_.jpg,https://www.amazon.in/Waterproof-Swimming-Trekking-Organizer-Multicolor/dp/B084T454X1/ref=sr_1_6610?qid=1679218590&s=luggage&sr=1-6610,3.1,2,₹548,₹799
"Trunkit Backpack 18""inch with Rain Cover 35 L (Sea Green)",bags & luggage,Backpacks,https://m.media-amazon.com/images/I/91A5rYvQOBL._AC_UL320_.jpg,https://www.amazon.in/Trunkit-Backpack-inch-Cover-Green/dp/B084JDGDLL/ref=sr_1_6611?qid=1679218590&s=luggage&sr=1-6611,4.0,1,₹759,"₹1,599"
Dagali Picnic Camping Portable Waterproof Tent (6 Person),bags & luggage,Backpacks,https://m.media-amazon.com/images/I/619kbj04wKL._AC_UL320_.jpg,https://www.amazon.in/Dagali-Picnic-Camping-Portable-Waterproof/dp/B084G55BTT/ref=sr_1_6612?qid=1679218590&s=luggage&sr=1-6612,,,"₹1,670","₹2,199"
HiLeder 100% Pure Genuine Premium Ndm Leather Spacious Formal 11.5 inch Backpack Laptop Office Bag,bags & luggage,Backpacks,https://m.media-amazon.com/images/I/91DWi4t5xgL._AC_UL320_.jpg,https://www.amazon.in/HiLEDER-Genuine-Premium-Spacious-Backpack/dp/B083GMXLR4/ref=sr_1_6613?qid=1679218590&s=luggage&sr=1-6613,3.0,2,"₹2,899","₹8,399"
PRIYAM DSLR SLR Camera & Lens Shoulder Backpack Camera Bag (Black) for All Camera Bags,bags & luggage,Backpacks,https://m.media-amazon.com/images/I/61zv-ml+C8L._AC_UL320_.jpg,https://www.amazon.in/Priyam%C2%AE-Camera-Shoulder-Backpack-Black/dp/B0834SYJ8L/ref=sr_1_6614?qid=1679218590&s=luggage&sr=1-6614,5.0,1,,₹875
"LONGING TO BUY A Cute All Natural Handmade Himalayan Hemp Backpack/Traveler Bag, A Great Product - God Siva Designed",bags & luggage,Backpacks,https://m.media-amazon.com/images/I/71eP-MJYKpL._AC_UL320_.jpg,https://www.amazon.in/Vanya-Handicraft-Collection-Handmade-Himalayan/dp/B082P2QKD3/ref=sr_1_6615?qid=1679218590&s=luggage&sr=1-6615,3.5,2,₹999,"₹2,599"
Fjallraven Kanken - Ochre Chess Pattern,bags & luggage,Backpacks,https://m.media-amazon.com/images/I/61spZ0eHwrL._AC_UL320_.jpg,https://www.amazon.in/Fjallraven-Kanken-Ochre-Chess-Pattern/dp/B082P2HVJZ/ref=sr_1_6616?qid=1679218590&s=luggage&sr=1-6616,4.6,144,"₹8,998","₹8,999"
Impulse 58.4 cms Red Rucksack (Haute Route 50 Litres Red),bags & luggage,Backpacks,https://m.media-amazon.com/images/I/61SuBE3P5WL._AC_UL320_.jpg,https://www.amazon.in/Impulse-50-Red-Haute-Route/dp/B082L1SQB7/ref=sr_1_6617?qid=1679218590&s=luggage&sr=1-6617,3.3,4,"₹1,767","₹3,999"
Blubags Casual Backpack with Led Watch,bags & luggage,Backpacks,https://m.media-amazon.com/images/I/81vbaDJSsrL._AC_UL320_.jpg,https://www.amazon.in/Blubags-Stylish-Casual-Backpack-Watch/dp/B082KPWPJZ/ref=sr_1_6618?qid=1679218590&s=luggage&sr=1-6618,3.6,4,₹599,"₹1,999"
Baywatch Double Side Locking Unisex Casual Polyester Laptop Backpack (Grey),bags & luggage,Backpacks,https://m.media-amazon.com/images/I/81q3qhrMAwL._AC_UL320_.jpg,https://www.amazon.in/Baywatch-Unisex-Casual-Polyester-Backpack/dp/B082419C4R/ref=sr_1_6619?qid=1679218590&s=luggage&sr=1-6619,5.0,2,₹510,"₹1,699"
MY FAV Water Resistant Backpack for Men and Women 20 Ltr Laptop Plus School Bag (Black),bags & luggage,Backpacks,https://m.media-amazon.com/images/I/91xOqNOYFnL._AC_UL320_.jpg,https://www.amazon.in/MY-FAV-Resistant-Backpack-Laptop/dp/B0823X7LDR/ref=sr_1_6620?qid=1679218590&s=luggage&sr=1-6620,,,₹499,₹999
"QIPS by HMI 25 Ltrs 17 Inch Laptop Backpack, Grey",bags & luggage,Backpacks,https://m.media-amazon.com/images/I/81gJ7ugWe3L._AC_UL320_.jpg,https://www.amazon.in/QIPS-Ltrs-Inch-Laptop-Backpack/dp/B08153NH6L/ref=sr_1_6621?qid=1679218590&s=luggage&sr=1-6621,3.0,2,,"₹1,999"
"QIPS 16 litres 17 Inch Anti Theft Laptop Backpack, Brown",bags & luggage,Backpacks,https://m.media-amazon.com/images/I/71pMoO1GK-L._AC_UL320_.jpg,https://www.amazon.in/QIPS-Laptop-Backpack-Resistant-Polyester/dp/B081535SSH/ref=sr_1_6622?qid=1679218590&s=luggage&sr=1-6622,2.0,1,,₹795
Skyline Waterproof & Trendy Laptop Backpack for College and Office Use(S-014-B),bags & luggage,Backpacks,https://m.media-amazon.com/images/I/81SDx2uUrLL._AC_UL320_.jpg,https://www.amazon.in/Skyline-Waterproof-Backpack-College-S-014-B/dp/B07ZXBNTM1/ref=sr_1_6623?qid=1679218590&s=luggage&sr=1-6623,1.0,1,₹649,"₹1,750"
Wildcraft Wiki Cascade Badge Backpack Black (11997 Black),bags & luggage,Backpacks,https://m.media-amazon.com/images/I/61GDPjb5AXL._AC_UL320_.jpg,https://www.amazon.in/Wildcraft-Cascade-Badge-Backpack-11997/dp/B07ZJ78QHG/ref=sr_1_6624?qid=1679218590&s=luggage&sr=1-6624,5.0,1,"₹2,500","₹2,649"
LEMONN Women's/Girls Preppy Style Fashion Waterproof Women Girls Backpack Korean Design Drawstring Chain travel College Of...,bags & luggage,Backpacks,https://m.media-amazon.com/images/W/IMAGERENDERING_521856-T2/images/I/51yyLDtCsgS._AC_UL320_.jpg,https://www.amazon.in/LEMONN-Waterproof-Backpack-Drawstring-LMNO-003/dp/B09S6KM4TM/ref=sr_1_6865?qid=1679218593&s=luggage&sr=1-6865,,,₹419,₹999
The Clownfish Marcellus Polyester 21.5 litres Unisex Travel Laptop Backpack for 14 inch Laptop (Bottle Green),bags & luggage,Backpacks,https://m.media-amazon.com/images/W/IMAGERENDERING_521856-T2/images/I/A10qfQY-NeL._AC_UL320_.jpg,https://www.amazon.in/Clownfish-Marcellus-Polyester-Litres-Backpack/dp/B09RV5SG4L/ref=sr_1_6866?qid=1679218593&s=luggage&sr=1-6866,FREE,Only 1 left in stock.,₹659,₹999
Babyzen YOYO Backpack,bags & luggage,Backpacks,https://m.media-amazon.com/images/W/IMAGERENDERING_521856-T2/images/I/81wzA9cN4ZL._AC_UL320_.jpg,https://www.amazon.in/Babyzen-BZ10202-03-YOYO-Backpack/dp/B09RQSBYW9/ref=sr_1_6867?qid=1679218593&s=luggage&sr=1-6867,4.4,10,,"₹9,500"
Afco Bags 30L Laptop Office/School/Travel/Business Backpack Water Resistant Fits Up to 15.6 Inch Laptop Bag(NAVYBLUE),bags & luggage,Backpacks,https://m.media-amazon.com/images/W/IMAGERENDERING_521856-T2/images/I/91yhB-1NEOL._AC_UL320_.jpg,https://www.amazon.in/Afco-Business-Backpack-Resistant-NAVYBLUE/dp/B09RMM5TXM/ref=sr_1_6868?qid=1679218593&s=luggage&sr=1-6868,3.0,1,₹499,"₹1,099"
"GOLDLINE Stylish 42L Leather Backpack for Office, School, College/Anti Theft Casual Laptop Bag/Office Backpack/Travel Bag/...",bags & luggage,Backpacks,https://m.media-amazon.com/images/W/IMAGERENDERING_521856-T2/images/I/81xSsPoZW0L._AC_UL320_.jpg,https://www.amazon.in/GOLDLINE-Stylish-Backpack-Multipurpose-51X27X30/dp/B09R1Z8244/ref=sr_1_6869?qid=1679218593&s=luggage&sr=1-6869,1.0,1,"₹1,351","₹3,999"
D DEFANZO 40L Backpack/School backpack/Travell backpack/Casual Backpack/Polyster Light Weight Casual Backpack(Advanture red),bags & luggage,Backpacks,https://m.media-amazon.com/images/W/IMAGERENDERING_521856-T2/images/I/71a+N-Hr4sL._AC_UL320_.jpg,https://www.amazon.in/DEfANZO-Backpack-backpack-Polyster-Advanture/dp/B09QRGVSMQ/ref=sr_1_6870?qid=1679218593&s=luggage&sr=1-6870,,,₹699,"₹1,499"
CABLE HUNTER Retro Travel Upgrade Vol large capacity Laptop/business/school travel Bagpack With USB Charging Port Tablet/M...,bags & luggage,Backpacks,https://m.media-amazon.com/images/W/IMAGERENDERING_521856-T2/images/I/91cScz9rbJL._AC_UL320_.jpg,https://www.amazon.in/Cable-Hunter%C2%AE-Limited-capacity-business/dp/B09PLFFFWR/ref=sr_1_6871?qid=1679218593&s=luggage&sr=1-6871,,,"₹2,499","₹4,999"
"King kian 10X14 (INCH) Size D Cut Cloth Carry Bag, Shopping Bag, Gift Bag, ECO Friendly Bag, Reusable Carry Bag Hand Bag P...",bags & luggage,Backpacks,https://m.media-amazon.com/images/W/IMAGERENDERING_521856-T2/images/I/41itEeM2ApL._AC_UL320_.jpg,https://www.amazon.in/Shopping-Friendly-Reusable-Grocery-Colours/dp/B09PK6HPVJ/ref=sr_1_6872?qid=1679218593&s=luggage&sr=1-6872,,,₹500,"₹1,700"
"ARUZEN Geometric Holographic Reflective Luminous Stylish Bag pack for Girls, and Women for College, School, and Office Sty...",bags & luggage,Backpacks,https://m.media-amazon.com/images/W/IMAGERENDERING_521856-T2/images/I/51UxD8BxCuL._AC_UL320_.jpg,https://www.amazon.in/ARUZEN-Geometric-Holographic-Reflective-Luminous/dp/B09P4RHWL1/ref=sr_1_6873?qid=1679218593&s=luggage&sr=1-6873,,,"₹1,499","₹1,999"
EXCLUZO 100 Pieces Rolling Barrel Swivels Bearing Hook Ring Fishing Accessories 19mm,bags & luggage,Backpacks,https://m.media-amazon.com/images/W/IMAGERENDERING_521856-T2/images/I/71h66UqLQzL._AC_UL320_.jpg,https://www.amazon.in/EXCLUZO-Rolling-Swivels-Bearing-Accessories/dp/B09NQBH89G/ref=sr_1_6874?qid=1679218593&s=luggage&sr=1-6874,1.0,1,₹789,"₹1,578"
"WENGER NEXT22, Mars 16 inches Laptop Backpack, 26 Liters Swiss Designed-Blend of Style and Function",bags & luggage,Backpacks,https://m.media-amazon.com/images/W/IMAGERENDERING_521856-T2/images/I/81t29cxwS5L._AC_UL320_.jpg,https://www.amazon.in/WENGER-NEXT22-Backpack-Designed-Blend-Function/dp/B09NC933FN/ref=sr_1_6875_mod_primary_new?qid=1679218593&s=luggage&sbo=RZvfv%2F%2FHxDF%2BO5021pAnSA%3D%3D&sr=1-6875,4.5,2,,"₹2,970"
Erminio Palamino Sequins Picnic Outdoor Travel Daypack Rucksack Cute Bagpack for Girls Womens| Trendy Collection 2022 | Fa...,bags & luggage,Backpacks,https://m.media-amazon.com/images/W/IMAGERENDERING_521856-T2/images/I/91SYK9WBWhL._AC_UL320_.jpg,https://www.amazon.in/Erminio-Palamino-Rucksack-Collection-Fashionable/dp/B09N2B17FZ/ref=sr_1_6876?qid=1679218593&s=luggage&sr=1-6876,4.2,13,₹449,₹999
AEROPOSTALE Wanderlust Backpack casual 30ltr capacity Teal,bags & luggage,Backpacks,https://m.media-amazon.com/images/W/IMAGERENDERING_521856-T2/images/I/61QveClGlDL._AC_UL320_.jpg,https://www.amazon.in/AEROPOSTALE-Wanderlust-Backpack-casual-capacity/dp/B09MYX9RNC/ref=sr_1_6877?qid=1679218593&s=luggage&sr=1-6877,,,"₹1,330","₹3,499"
Afco Bags Casual Waterproof Laptop Backpack/Office Bag/School Bag/College Bag/Business Bag/Unisex Travel Backpack (Compati...,bags & luggage,Backpacks,https://m.media-amazon.com/images/W/IMAGERENDERING_521856-T2/images/I/91mkNOHpa-L._AC_UL320_.jpg,https://www.amazon.in/Waterproof-Backpack-College-Business-Compatible/dp/B09MKSKK45/ref=sr_1_6878?qid=1679218593&s=luggage&sr=1-6878,3.0,2,₹449,₹999
Thames 45 Litre Rucksack Travel Backpack (orange),bags & luggage,Backpacks,https://m.media-amazon.com/images/W/IMAGERENDERING_521856-T2/images/I/817rzxm+cFL._AC_UL320_.jpg,https://www.amazon.in/THAMES-45-Rucksack-Travel-Backpack/dp/B09M883978/ref=sr_1_6879?qid=1679218593&s=luggage&sr=1-6879,1.4,3,₹899,"₹2,999"
CLOUDS GEAR Polyester 29 litres Office Laptop Backpack - Sleek Everyday use Backpack - (Grey Milanjh),bags & luggage,Backpacks,https://m.media-amazon.com/images/W/IMAGERENDERING_521856-T2/images/I/71MZ5klRqDL._AC_UL320_.jpg,https://www.amazon.in/CLOUDS-GEAR-Polyester-litres-Backpack/dp/B09LVKYMPK/ref=sr_1_6880?qid=1679218593&s=luggage&sr=1-6880,4.0,1,₹799,"₹2,199"
ROBAGO Blue Next Casual Waterproof Laptop Backpack Bag for Men Women Boys Girls/Office School College Teens & Students wit...,bags & luggage,Backpacks,https://m.media-amazon.com/images/W/IMAGERENDERING_521856-T2/images/I/61WVIc-Ta-L._AC_UL320_.jpg,https://www.amazon.in/ROBAGO-Waterproof-Backpack-College-Students/dp/B09L7S11JG/ref=sr_1_6881?qid=1679218593&s=luggage&sr=1-6881,4.4,6,₹999,"₹1,899"
ZERUS Unisex Travel Backpack for Hiking Trekking Bag Camping Rucksack Waterproof Travelling Bag With Shoe Compartment (Bla...,bags & luggage,Backpacks,https://m.media-amazon.com/images/W/IMAGERENDERING_521856-T2/images/I/71+BI4onajL._AC_UL320_.jpg,https://www.amazon.in/Backpack-Trekking-Waterproof-Travelling-Compartment/dp/B09L4YG5DC/ref=sr_1_6882?qid=1679218593&s=luggage&sr=1-6882,3.0,1,₹849,"₹3,999"
BOPAI Water Resistant Soft Laptop Backpack Female Backpack for Career Women,bags & luggage,Backpacks,https://m.media-amazon.com/images/W/IMAGERENDERING_521856-T2/images/I/51CT+fxadbL._AC_UL320_.jpg,https://www.amazon.in/BOPAI-Waterproof-Business-Laptop-Backpack/dp/B09KC5WP1B/ref=sr_1_6883?qid=1679218593&s=luggage&sr=1-6883,5.0,1,"₹4,749","₹8,499"
"CLOUDS GEAR Polyester Laptop Outdoor Backpack, 18 inch 30 L - Above Hiking Waterproof Travel Daypack - (Black)",bags & luggage,Backpacks,https://m.media-amazon.com/images/W/IMAGERENDERING_521856-T2/images/I/71J+7oF+GwL._AC_UL320_.jpg,https://www.amazon.in/CLOUDS-GEAR-Polyester-Outdoor-Backpack/dp/B09JKGMZKQ/ref=sr_1_6884?qid=1679218593&s=luggage&sr=1-6884,,,"₹1,299","₹2,499"
"Sturdy International Lightweight Backpack for School, Water Resistant Casual Daypack for Travel with Bottle Side Pockets (...",bags & luggage,Backpacks,https://m.media-amazon.com/images/W/IMAGERENDERING_521856-T2/images/I/41vE54+rPzL._AC_UL320_.jpg,https://www.amazon.in/International-Lightweight-Backpack-Resistant-Daypack/dp/B09J3QGQ73/ref=sr_1_6885?qid=1679218593&s=luggage&sr=1-6885,1.4,7,₹649,"₹1,899"
Shanvi Handicraft New Himalayan Hemp Laptop Bag Backpack/ School & Traveler Bag (Multicolor),bags & luggage,Backpacks,https://m.media-amazon.com/images/W/IMAGERENDERING_521856-T2/images/I/71CrXinkfhL._AC_UL320_.jpg,https://www.amazon.in/Handicraft-Himalayan-Backpack-Traveler-Multicolor/dp/B09J1BXG4J/ref=sr_1_6886?qid=1679218593&s=luggage&sr=1-6886,,,₹897,"₹2,499"
Mars Minis Travel Edition 27 Bars Sharing Bag 500g,bags & luggage,Backpacks,https://m.media-amazon.com/images/W/IMAGERENDERING_521856-T2/images/I/7159TTzyeXL._AC_UL320_.jpg,https://www.amazon.in/Mars-Minis-Travel-Bars-Sharing/dp/B09HSDMFZ1/ref=sr_1_6887?qid=1679218593&s=luggage&sr=1-6887,,,"₹1,399","₹1,499"
Platinum Black - Strongest Fishing Hooks Sizes No.6 Quantity:Total 50pcs Length-1.8cm Hollow Point Ringed Super Strongest ...,bags & luggage,Backpacks,https://m.media-amazon.com/images/W/IMAGERENDERING_521856-T2/images/I/41Mr4p1AcYL._AC_UL320_.jpg,https://www.amazon.in/Platinum-Black-Strongest-Length-1-8cm-Guaranteed/dp/B09HKCX42Z/ref=sr_1_6888?qid=1679218593&s=luggage&sr=1-6888,3.3,12,₹395,₹590
FASHION SHINE Casual Waterproof Laptop Bag/Backpack for Men Women Boys Girls/Office School College Teens & Students,bags & luggage,Backpacks,https://m.media-amazon.com/images/W/IMAGERENDERING_521856-T2/images/I/61r1j83exPL._AC_UL320_.jpg,https://www.amazon.in/FASHION-SHINE-Waterproof-Backpack-Students/dp/B09HCHVVQZ/ref=sr_1_6889?qid=1679218593&s=luggage&sr=1-6889,,,₹449,"₹1,699"
"Homava Casual Nylon Waterproof Backpack, 44.5 X 30 X 20 cm, 10 L, Red",bags & luggage,Backpacks,https://m.media-amazon.com/images/W/IMAGERENDERING_521856-T2/images/I/31aW+w1u9XL._AC_UL320_.jpg,https://www.amazon.in/Homava-Casual-Nylon-Waterproof-Backpack/dp/B09HBYJDWJ/ref=sr_1_6890?qid=1679218593&s=luggage&sr=1-6890,,,₹349,₹699
Shanvi Handicraft New Himalayan Hemp Laptop Bag Backpack/ School & Traveler Bag (Elephant Design Multicolor),bags & luggage,Backpacks,https://m.media-amazon.com/images/W/IMAGERENDERING_521856-T2/images/I/713BYGlXUeL._AC_UL320_.jpg,https://www.amazon.in/Handicraft-Himalayan-Backpack-Traveler-Multicolor/dp/B09H3943SX/ref=sr_1_6891?qid=1679218593&s=luggage&sr=1-6891,,,₹947,"₹2,499"
ULTRAFINE 101 L Easy Carriage Blue Large Size Bike Pickup Grocery/Courier/Logistic/E-Commerce/Food/Meal/Lunch Boxes Multip...,bags & luggage,Backpacks,https://m.media-amazon.com/images/W/IMAGERENDERING_521856-T2/images/I/41grDRwZN+L._AC_UL320_.jpg,https://www.amazon.in/ULTRAFINE-Carriage-Logistic-Commerce-Multipurpose/dp/B09GKWPH2K/ref=sr_1_6892?qid=1679218593&s=luggage&sr=1-6892,4.0,1,"₹1,599","₹3,499"
AEROPOSTALE Wanderlust Backpack casual 30ltr capacity,bags & luggage,Backpacks,https://m.media-amazon.com/images/W/IMAGERENDERING_521856-T2/images/I/61vvBAfmioL._AC_UL320_.jpg,https://www.amazon.in/AEROPOSTALE-Wanderlust-Backpack-casual-capacity/dp/B09GFYMXRC/ref=sr_1_6893?qid=1679218593&s=luggage&sr=1-6893,5.0,2,"₹1,330","₹3,499"
AMRAZ New 25L Backpack Water Proof Causal Travel School College Tution Backpack,bags & luggage,Backpacks,https://m.media-amazon.com/images/W/IMAGERENDERING_521856-T2/images/I/41BcsPPpH0L._AC_UL320_.jpg,https://www.amazon.in/AMRAZ-Backpack-Causal-Travel-College/dp/B09FY3C492/ref=sr_1_6894?qid=1679218593&s=luggage&sr=1-6894,,,₹499,"₹1,199"
BELAIR Polyester 35L Water Resistant Travel Bagpack/College Backpack/School Bag/Office Bag/Business Backpack/Daypack for M...,bags & luggage,Backpacks,https://m.media-amazon.com/images/W/IMAGERENDERING_521856-T2/images/I/71ZjB1XGbZL._AC_UL320_.jpg,https://www.amazon.in/BELAIR-Polyester-Resistant-Backpack-Business/dp/B09FTK2D5Z/ref=sr_1_6895?qid=1679218593&s=luggage&sr=1-6895,,,₹499,"₹2,199"
Gold - Strongest Fishing Hooks Sizes No.1 Colour Gold Yellow Quantity:Total 25pcs Length-2.9cm Width-1.1cm Hollow Point Ri...,bags & luggage,Backpacks,https://m.media-amazon.com/images/W/IMAGERENDERING_521856-T2/images/I/41DEAKlT3EL._AC_UL320_.jpg,https://www.amazon.in/Gold-Strongest-Length-2-9cm-Width-1-1cm-Guaranteed/dp/B09F6WJG9N/ref=sr_1_6896?qid=1679218593&s=luggage&sr=1-6896,,,₹320,₹390
MANLAK Printed Canvas Strip With Tan Backpack Bag for Girls Womens School College Travel Purpose,bags & luggage,Backpacks,https://m.media-amazon.com/images/W/IMAGERENDERING_521856-T2/images/I/71TAMD2Cm+L._AC_UL320_.jpg,https://www.amazon.in/MANLAK-Printed-Backpack-College-Purpose/dp/B09F6HQWVY/ref=sr_1_6897?qid=1679218593&s=luggage&sr=1-6897,,,₹799,"₹1,699"
"STYLISH TREKKING BACKPACK (24, GREY) HIKING TRAVEL OUTDOOR SPORT QAULITY",bags & luggage,Backpacks,https://m.media-amazon.com/images/W/IMAGERENDERING_521856-T2/images/I/51XZMtUF7YL._AC_UL320_.jpg,https://www.amazon.in/STYLISH-TREKKING-BACKPACK-OUTDOOR-QAULITY/dp/B09DVRVJMJ/ref=sr_1_6898?qid=1679218593&s=luggage&sr=1-6898,,,₹669,"₹1,899"
Wild Hook Vintage Leather Backpack For Women Top Grain Genuine Leather Convertible bag Comes in black and brown one size,bags & luggage,Backpacks,https://m.media-amazon.com/images/W/IMAGERENDERING_521856-T2/images/I/816yQY3NmkL._AC_UL320_.jpg,https://www.amazon.in/Vintage-Leather-Backpack-Genuine-Convertible/dp/B09DPXW2HN/ref=sr_1_6899?qid=1679218593&s=luggage&sr=1-6899,4.5,6,"₹5,999","₹14,999"
VAMSUM JAKHU STREET SERIES 15 L Backpack,bags & luggage,Backpacks,https://m.media-amazon.com/images/W/IMAGERENDERING_521856-T2/images/I/71R0YmMbS4L._AC_UL320_.jpg,https://www.amazon.in/VAMSUM-JAKHU-STREET-Backpack-Polka/dp/B09DKDPFZM/ref=sr_1_6900?qid=1679218593&s=luggage&sr=1-6900,,,₹445,₹999
"EDIFIER Shoulder Camera Bag For DSLR/SLR Camera,Black",bags & luggage,Backpacks,https://m.media-amazon.com/images/W/IMAGERENDERING_521856-T2/images/I/51XHRFJE1+L._AC_UL320_.jpg,https://www.amazon.in/Edifier-Shoulder-Camera-Bag-DSLR/dp/B09DGF5QZD/ref=sr_1_6901?qid=1679218593&s=luggage&sr=1-6901,2.0,2,₹539,₹599
Stephen Joseph Quilted Backpack Ballet,bags & luggage,Backpacks,https://m.media-amazon.com/images/W/IMAGERENDERING_521856-T2/images/I/81wRbUtlIcL._AC_UL320_.jpg,https://www.amazon.in/Stephen-Joseph-Quilted-Backpack-Ballet/dp/B09D8QGHRT/ref=sr_1_6902?qid=1679218593&s=luggage&sr=1-6902,,,,"₹1,800"
Alison Small 8 L Backpack Women / Girls Stylish Trendy College Casual School Hand & Shoulder Bag (Pink),bags & luggage,Backpacks,https://m.media-amazon.com/images/W/IMAGERENDERING_521856-T2/images/I/61no6dyhynL._AC_UL320_.jpg,https://www.amazon.in/Alison-Backpack-Stylish-College-Shoulder/dp/B09CHGV1LG/ref=sr_1_6903?qid=1679218593&s=luggage&sr=1-6903,,,₹456,"₹1,299"
Layfuz Hydration Pack Backpack with 2L Water Bladder Super Lightweight Breathable Hydration Vest for Outdoors Running Cycl...,bags & luggage,Backpacks,https://m.media-amazon.com/images/W/IMAGERENDERING_521856-T2/images/I/61f6bCyPQJS._AC_UL320_.jpg,https://www.amazon.in/Layfuz-Hydration-Backpack-Lightweight-Breathable/dp/B09C33G265/ref=sr_1_6904?qid=1679218593&s=luggage&sr=1-6904,,,"₹4,379.53","₹6,789.22"
Charged Sports Bag Utile Laptop Bag Blue With Gowin Sports Training Shoe Nx-2 Grey Red Size 8,bags & luggage,Backpacks,https://m.media-amazon.com/images/W/IMAGERENDERING_521856-T2/images/I/91-kntXwwiL._AC_UL320_.jpg,https://www.amazon.in/Charged-Sports-Laptop-Leather-Training/dp/B09BMB9XL3/ref=sr_1_6905?qid=1679218593&s=luggage&sr=1-6905,,,"₹1,376","₹1,609"
FUR JADEN Combo of 2 Anti Theft Water Repellent 15.6 Inch Laptop Backpack Bag with USB Charging Port(Black & Black),bags & luggage,Backpacks,https://m.media-amazon.com/images/W/IMAGERENDERING_521856-T2/images/I/41SHuigtLVL._AC_UL320_.jpg,https://www.amazon.in/Combo-Repellent-Laptop-Backpack-Charging/dp/B09BFBR3N2/ref=sr_1_6906?qid=1679218593&s=luggage&sr=1-6906,5.0,1,"₹1,588","₹7,500"
Devagabond Glora 32 L Capacity Nylon Trendy Water-resistant Laptop Bag ( Black ),bags & luggage,Backpacks,https://m.media-amazon.com/images/W/IMAGERENDERING_521856-T2/images/I/91PtN9HM-9L._AC_UL320_.jpg,https://www.amazon.in/Devagabond-Glora-Capacity-Trendy-Water-resistant/dp/B09BDGY6T1/ref=sr_1_6907?qid=1679218593&s=luggage&sr=1-6907,,,"₹1,199","₹2,199"
VIDISA Anti Theft Laptop Bag with USB Cable and Built in Charging Port Laptop Backpack | 45 X 28 X 12 CM | Pink,bags & luggage,Backpacks,https://m.media-amazon.com/images/W/IMAGERENDERING_521856-T2/images/I/41DNyZ5CA9L._AC_UL320_.jpg,https://www.amazon.in/VIDISA-Theft-Laptop-Charging-Backpack/dp/B09B7625GW/ref=sr_1_6908?qid=1679218593&s=luggage&sr=1-6908,3.0,1,₹799,"₹1,499"
You Are Awesome - Goku Dragon Ball Z Double Layered Laptop Skin (15.6inch),bags & luggage,Backpacks,https://m.media-amazon.com/images/W/IMAGERENDERING_521856-T2/images/I/61GkGR6qNxL._AC_UL320_.jpg,https://www.amazon.in/You-Are-Awesome-Layered-15-6inch/dp/B09B68RFZ3/ref=sr_1_6909?qid=1679218593&s=luggage&sr=1-6909,,,₹279,₹499
Hot/Cold zomato/swiggy/Food/Pizza delivery Backpack 14 inch 34 LTR (Yellow),bags & luggage,Backpacks,https://m.media-amazon.com/images/W/IMAGERENDERING_521856-T2/images/I/6185gyss7GL._AC_UL320_.jpg,https://www.amazon.in/zomato-swiggy-delivery-Backpack-Yellow/dp/B099QML1M9/ref=sr_1_6910?qid=1679218593&s=luggage&sr=1-6910,2.0,1,₹895,"₹1,499"
TYPIFY® PU Leather Women Backpack College Office Bag Girls Blue,bags & luggage,Backpacks,https://m.media-amazon.com/images/W/IMAGERENDERING_521856-T2/images/I/71tBUE6uGyL._AC_UL320_.jpg,https://www.amazon.in/TYPIFY%C2%AE-Leather-Backpack-College-Office/dp/B099PZV5X4/ref=sr_1_6911?qid=1679218593&s=luggage&sr=1-6911,3.0,1,₹299,"₹1,699"
PU Leather 15 Inches Dual Laptop Backpack-Messenger Bag with USB,bags & luggage,Backpacks,https://m.media-amazon.com/images/W/IMAGERENDERING_521856-T2/images/I/91olMUiPY2S._AC_UL320_.jpg,https://www.amazon.in/Leather-Inches-Dual-Laptop-Backpack-Messenger/dp/B099N5B5XY/ref=sr_1_6912?qid=1679218593&s=luggage&sr=1-6912,,,"₹1,299","₹2,499"
PU Leather 15 Inches Dual Laptop Backpack-Messenger Bag with USB,bags & luggage,Backpacks,https://m.media-amazon.com/images/I/91olMUiPY2S._AC_UL320_.jpg,https://www.amazon.in/Leather-Inches-Dual-Laptop-Backpack-Messenger/dp/B099N5B5XY/ref=sr_1_6913?qid=1679218594&s=luggage&sr=1-6913,,,"₹1,299","₹2,499"
"Maverick Flem-O Cubes Dry Fuel Cubes for Travel, Outdoor Sports, Camping and Hiking White (36 Nos)",bags & luggage,Backpacks,https://m.media-amazon.com/images/I/51O2UDX5u3S._AC_UL320_.jpg,https://www.amazon.in/Maverick-Travel-Outdoor-Sports-Camping/dp/B0995GM33N/ref=sr_1_6914?qid=1679218594&s=luggage&sr=1-6914,,,₹650,₹945
DEVZA Polyester Waterproof Foldable Collapsible Rucksack Unisex Backpack for Travel and Sports | 26 X 8 X 38 CM | Purple,bags & luggage,Backpacks,https://m.media-amazon.com/images/I/51wybULWJtS._AC_UL320_.jpg,https://www.amazon.in/DEVZA-Polyester-Waterproof-Foldable-Collapsible/dp/B0993MW3HY/ref=sr_1_6915?qid=1679218594&s=luggage&sr=1-6915,3.0,1,₹449,₹899
"OMRON BAGS Laptop Backpack With USB Charging Port, Water Resistant with College Computer Bag for Men & Women (Dark grey)",bags & luggage,Backpacks,https://m.media-amazon.com/images/I/81zjLpWUl3L._AC_UL320_.jpg,https://www.amazon.in/OMRON-BAGS-Backpack-Charging-Resistant/dp/B0991W181X/ref=sr_1_6916?qid=1679218594&s=luggage&sr=1-6916,2.9,3,₹599,"₹1,499"
VETERIS Antique Brass Compass Nautical Pocket Backpacking Compass Leather Case Vintage Camping Hiking Direction Marine Gra...,bags & luggage,Backpacks,https://m.media-amazon.com/images/I/71BxrMNIz1S._AC_UL320_.jpg,https://www.amazon.in/VETERIS-Backpacking-Graduation-Confirmation-Engravable/dp/B098TZJ4NZ/ref=sr_1_6917?qid=1679218594&s=luggage&sr=1-6917,,,₹899,"₹1,299"
"STYLISH TREKKING BACKPACK (24, SKY BLUE) HIKING TRAVEL OUTDOOR SPORT",bags & luggage,Backpacks,https://m.media-amazon.com/images/I/51bIlXX2RcS._AC_UL320_.jpg,https://www.amazon.in/STYLISH-TREKKING-BACKPACK-SKY-OUTDOOR/dp/B098R4VSB9/ref=sr_1_6918?qid=1679218594&s=luggage&sr=1-6918,,,₹649,"₹1,899"
7pcs Ceramic Ring Eyes Fishing Rod Guides Double Leg Stainless Steel Frame,bags & luggage,Backpacks,https://m.media-amazon.com/images/I/51Hlrzk01fL._AC_UL320_.jpg,https://www.amazon.in/Ceramic-Fishing-Guides-Double-Stainless/dp/B098DJ4J6X/ref=sr_1_6919?qid=1679218594&s=luggage&sr=1-6919,,,₹638,"₹1,149"
ACEKING Leather Laptop Backpack Bag For Men Office Use With Upto 16 Inches Laptop Compartment Bagpack Bag Unisex Color,bags & luggage,Backpacks,https://m.media-amazon.com/images/I/41WeU-kZV5S._AC_UL320_.jpg,https://www.amazon.in/ACEKING-Leather-Backpack-Compartment-Bagpack/dp/B098827LZV/ref=sr_1_6920?qid=1679218594&s=luggage&sr=1-6920,,,"₹5,376","₹12,500"
Axpro Ultimate Sports Casual Gym Football Multipurpose Kit Bag Walking Backpack for Men,bags & luggage,Backpacks,https://m.media-amazon.com/images/I/81mCbD9yaGS._AC_UL320_.jpg,https://www.amazon.in/Axpro-Ultimate-Football-Multipurpose-Backpack/dp/B0987SDGB8/ref=sr_1_6921?qid=1679218594&s=luggage&sr=1-6921,3.4,4,₹249,₹500
