name,main_category,sub_category,image,link,ratings,no_of_ratings,discount_price,actual_price
"Good Friends School Bag, College Backpack, Laptop Bag Festival Offer Digital Watch Combo (Grey)",bags & luggage,Backpacks,https://m.media-amazon.com/images/I/91O3DLUWUSL._AC_UL320_.jpg,https://www.amazon.in/Good-Friends-College-Backpack-Festival/dp/B0BY5684YT/ref=sr_1_8203?qid=1679218606&s=luggage&sr=1-8203,,,₹699,"₹2,199"
Good Friends Casual Laptop Backpack/Office Bag/School Bag/College Bag/Business Bag/Unisex Backpack & Digital Watch(Grey),bags & luggage,Backpacks,https://m.media-amazon.com/images/I/81C0qHZNH9L._AC_UL320_.jpg,https://www.amazon.in/Good-Friends-Backpack-College-Business/dp/B0BY567HSG/ref=sr_1_8204?qid=1679218606&s=luggage&sr=1-8204,,,₹699,"₹2,199"
Deal Castle Kids 3D Soft Plush Cute Unicorn Tuition and Travel Backpack,bags & luggage,Backpacks,https://m.media-amazon.com/images/I/51fu9TMMPJL._AC_UL320_.jpg,https://www.amazon.in/Castle-Unicorn-Tuition-Travel-Backpack/dp/B0BY56471T/ref=sr_1_8205?qid=1679218606&s=luggage&sr=1-8205,,,₹399,₹899
OUR BRAND Aimson Mini Stylish Backpack for Girls | Women's Fashion Backpack,bags & luggage,Backpacks,https://m.media-amazon.com/images/I/41aH-dcyY6L._AC_UL320_.jpg,https://www.amazon.in/OUR-BRAND-Stylish-Backpack-Turqouise/dp/B0BY529QGN/ref=sr_1_8206?qid=1679218606&s=luggage&sr=1-8206,,,"₹1,099","₹1,599"
LOADSHARE Unicorn bagpack Fashion School Backpack Girls and Women Bookbag Set Student Laptop Backpack College going bag,bags & luggage,Backpacks,https://m.media-amazon.com/images/I/515tHlP2giL._AC_UL320_.jpg,https://www.amazon.in/LOADSHARE-Unicorn-bagpack-Fashion-Backpack/dp/B0BY4JF564/ref=sr_1_8207?qid=1679218606&s=luggage&sr=1-8207,,,₹399,₹699
"LONGING TO BUY HEMP LAPTOP BACKPACK, HEMP SHOULDER BACKPACK FOR MEN AND WOMEN",bags & luggage,Backpacks,https://m.media-amazon.com/images/I/81DBR+TE4fL._AC_UL320_.jpg,https://www.amazon.in/LONGING-BUY-BACKPACK-SHOULDER-Rangoli/dp/B0BY2Z4W4Z/ref=sr_1_8208?qid=1679218606&s=luggage&sr=1-8208,,,"₹1,299","₹2,499"
SCUFFLE Mint Stylish Unisex Waterproof 30 L Laptop backpack Bag/Office Bag/School Bag/College Bag/Business Bag/Travel Back...,bags & luggage,Backpacks,https://m.media-amazon.com/images/I/21dX9hesoQL._AC_UL320_.jpg,https://www.amazon.in/SCUFFLE-MINT-Waterproof-backpack-Compatible/dp/B0BY2XYKMM/ref=sr_1_8209?qid=1679218607&s=luggage&sr=1-8209,,,₹575,"₹2,999"
"ABJI Anti Theft Sling Crossbody Backpack Shoulder Bag for Men, Lightweight One Strap Motorcycle Backpack Sling Bag Backpac...",bags & luggage,Backpacks,https://m.media-amazon.com/images/I/61FlHbDmEKL._AC_UL320_.jpg,https://www.amazon.in/ABJI-Crossbody-Bag-Lightweight-Motorcycle/dp/B0BY2TJBYG/ref=sr_1_8210?qid=1679218607&s=luggage&sr=1-8210,,,₹828,"₹1,699"
ABJI Men's Women's Sling Bag Water Resistant Cross Body Chest Bag Outdoor Cycling Chest Shoulder Unbalance Gym Fashion Bag...,bags & luggage,Backpacks,https://m.media-amazon.com/images/I/61FlHbDmEKL._AC_UL320_.jpg,https://www.amazon.in/ABJI-Bag-Resistant-Cross-Unbalance/dp/B0BY2TCY48/ref=sr_1_8211?qid=1679218607&s=luggage&sr=1-8211,,,₹809,"₹1,699"
Northzone Laptop Backpack Laptop Bags Casual 30L Office School Travel Business Bag Backpack for Men Women Boys Girls Fits ...,bags & luggage,Backpacks,https://m.media-amazon.com/images/I/61ghmhBOX7L._AC_UL320_.jpg,https://www.amazon.in/Northzone-Laptop-Backpack-Business-Notebook/dp/B0BY2M6SJB/ref=sr_1_8212?qid=1679218607&s=luggage&sr=1-8212,,,₹499,"₹1,599"
HOT SHOT Kids Bag 023 |Penguin Bag|School Bag|2TO5 Years|BOY & Girl|12 Liters Preschool & Nursery Waterproof Plush Bag,bags & luggage,Backpacks,https://m.media-amazon.com/images/I/61B0ZuXGH+L._AC_UL320_.jpg,https://www.amazon.in/HOT-SHOT-Penguin-Preschool-Waterproof/dp/B0BY2L4Y7R/ref=sr_1_8213?qid=1679218607&s=luggage&sr=1-8213,,,₹349,₹649
TANN TRIM Tann Flap Backpack Metro Mover 2.0 | Laptop Backpack For Work | 15 Inch Laptop Backpack | 25 Litres Backpack | T...,bags & luggage,Backpacks,https://m.media-amazon.com/images/I/51ziB4lOZpL._AC_UL320_.jpg,https://www.amazon.in/TANN-TRIM-Backpack-Work-Backpack-Backpacks/dp/B0BY2KMSR6/ref=sr_1_8214?qid=1679218607&s=luggage&sr=1-8214,,,,"₹5,899"
TANN TRIM Mini Black Backpack Metro Mover 2.0 | Laptop Backpack For Work | 13 Inch Laptop Backpack | 15 Litres Backpack | ...,bags & luggage,Backpacks,https://m.media-amazon.com/images/I/51wFxyIdVmL._AC_UL320_.jpg,https://www.amazon.in/TANN-TRIM-Backpack-Work-Backpack-Backpacks/dp/B0BY2JZB7N/ref=sr_1_8215?qid=1679218607&s=luggage&sr=1-8215,,,,"₹4,299"
Enakshi Solid Color Backpack Lightweight for Camping Outdoor Activities Short Trips Yellow (Women's Handbags & Bags),bags & luggage,Backpacks,https://m.media-amazon.com/images/I/61pK+HGZ8TL._AC_UL320_.jpg,https://www.amazon.in/Enakshi-Backpack-Lightweight-Activities-Handbags/dp/B0BY28NBP4/ref=sr_1_8216?qid=1679218607&s=luggage&sr=1-8216,,,"₹3,047","₹5,790"
"Enakshi Computer Bag Daypack Gifts Travel Backpacking Tote Storage Laptop Backpack Brown (Backpacks, Bags & Briefcases)",bags & luggage,Backpacks,https://m.media-amazon.com/images/I/61JZDSoSlWL._AC_UL320_.jpg,https://www.amazon.in/Enakshi-Computer-Backpacking-Backpacks-Briefcases/dp/B0BY27NPQD/ref=sr_1_8217?qid=1679218607&s=luggage&sr=1-8217,,,"₹2,499","₹4,749"
Himalayan 20L Water Restant Office Laptop Bag/Backpack for Men/Women/(Green),bags & luggage,Backpacks,https://m.media-amazon.com/images/I/81YocU-VdML._AC_UL320_.jpg,https://www.amazon.in/Himalayan-Restant-Office-Laptop-Backpack/dp/B0BY276MY1/ref=sr_1_8218?qid=1679218607&s=luggage&sr=1-8218,,,₹850,"₹2,250"
BLOORA 42L WATER RESISTANT OFFICE LAPTOP BAG/BACKPACK FOR MEN/WOMEN (BLACK),bags & luggage,Backpacks,https://m.media-amazon.com/images/I/81dlmGqD+SL._AC_UL320_.jpg,https://www.amazon.in/BLOORA-RESISTANT-OFFICE-LAPTOP-BACKPACK/dp/B0BXZ49SWV/ref=sr_1_8219?qid=1679218607&s=luggage&sr=1-8219,,,"₹1,299","₹3,299"
Forever Young Mini Backpack for Girls (Pink),bags & luggage,Backpacks,https://m.media-amazon.com/images/I/41mTNFW4O8L._AC_UL320_.jpg,https://www.amazon.in/Forever-Young-Mini-Backpack-Girls/dp/B0BXZ461ZL/ref=sr_1_8220?qid=1679218607&s=luggage&sr=1-8220,,,₹999,"₹1,999"
Casual Laptop Backpack School/College/Travel 42L Polyster,bags & luggage,Backpacks,https://m.media-amazon.com/images/I/91lCBdV+cUL._AC_UL320_.jpg,https://www.amazon.in/Casual-Laptop-Backpack-College-Polyster/dp/B0BXYB6HGF/ref=sr_1_8221?qid=1679218607&s=luggage&sr=1-8221,,,,
NGOLD Leather Laptop Backpack,bags & luggage,Backpacks,https://m.media-amazon.com/images/I/915u2hgrimL._AC_UL320_.jpg,https://www.amazon.in/NGOLD-LTBP-021-Leather-Backpack/dp/B0BXYB3LG4/ref=sr_1_8222?qid=1679218607&s=luggage&sr=1-8222,,,"₹3,499","₹7,999"
SEAKING Medium 25 L Backpack Small Bags Backpack for daily use library office outdoor hiking Backpack,bags & luggage,Backpacks,https://m.media-amazon.com/images/I/51HjvgErs4L._AC_UL320_.jpg,https://www.amazon.in/SEAKING-Medium-Backpack-library-outdoor/dp/B0BXY7LYNK/ref=sr_1_8223?qid=1679218607&s=luggage&sr=1-8223,,,,
Sports Casual Gym Football Multipurpose Kit Bag Walking Backpack for Men,bags & luggage,Backpacks,https://m.media-amazon.com/images/I/41eJHOghSLL._AC_UL320_.jpg,https://www.amazon.in/Sports-Football-Multipurpose-Walking-Backpack/dp/B0BXXVJP1F/ref=sr_1_8224?qid=1679218607&s=luggage&sr=1-8224,,,₹199,₹500
SEAKING Small 20 L Laptop Backpack Medium 20 L Laptop Backpack Stylish Ganji Bag Office Bag (Black),bags & luggage,Backpacks,https://m.media-amazon.com/images/I/51Cfp3p-2ZL._AC_UL320_.jpg,https://www.amazon.in/SEAKING-Laptop-Backpack-Medium-Stylish/dp/B0BXXTG93L/ref=sr_1_8225?qid=1679218607&s=luggage&sr=1-8225,,,,
JSMSH A3 Size Document Zip Bag/Pouch 9 INCH X 13 INCH - Multicolour (Pack of 5),bags & luggage,Backpacks,https://m.media-amazon.com/images/I/71RSRlXb4cL._AC_UL320_.jpg,https://www.amazon.in/JSMSH-Size-Document-Pouch-INCH/dp/B0BXXPQJCF/ref=sr_1_8226?qid=1679218607&s=luggage&sr=1-8226,,,₹459,"₹5,999"
LOOKMUSTER 35 L Travel Backpack for Outdoor Sport Camp Hiking Trekking Bag Camping Rucksack,bags & luggage,Backpacks,https://m.media-amazon.com/images/I/51ngquvCvsL._AC_UL320_.jpg,https://www.amazon.in/LOOKMUSTER-Backpack-Outdoor-Trekking-Rucksack/dp/B0BXXDYLKC/ref=sr_1_8227?qid=1679218607&s=luggage&sr=1-8227,,,₹498,₹999
SELAXO Bags- Laptop Backpack 30. LTR. Polyester -Orange),bags & luggage,Backpacks,https://m.media-amazon.com/images/I/71s-Rlj74tL._AC_UL320_.jpg,https://www.amazon.in/SELAXO-Laptop-Backpack-Polyester-Orange/dp/B0BXXCTN8Z/ref=sr_1_8228?qid=1679218607&s=luggage&sr=1-8228,,,₹499,"₹1,199"
Lets Play 3D Water Proof Primary School Bag Cute Cartoon Kids Backpack For Kids (Pink),bags & luggage,Backpacks,https://m.media-amazon.com/images/I/71r9iB6j6DL._AC_UL320_.jpg,https://www.amazon.in/Water-Primary-School-Cartoon-Backpack/dp/B0BXWW7F5N/ref=sr_1_8229?qid=1679218607&s=luggage&sr=1-8229,,,"₹1,499","₹1,999"
SEWARTS Black and White Polka Print Cute Stylish Female Student School Collage Bags Girls Women’s Backpack cum Sling Bag,bags & luggage,Backpacks,https://m.media-amazon.com/images/I/71B-R-k8veL._AC_UL320_.jpg,https://www.amazon.in/SEWARTS-Stylish-Student-Collage-Backpack/dp/B0BXTQ5894/ref=sr_1_8230?qid=1679218607&s=luggage&sr=1-8230,,,₹679,"₹1,199"
NGOLD Classy Leather Backpack for Women,bags & luggage,Backpacks,https://m.media-amazon.com/images/I/81RIlqkDQ1L._AC_UL320_.jpg,https://www.amazon.in/NGOLD-Classy-Leather-Backpack-Women/dp/B0BXTF2QBT/ref=sr_1_8231?qid=1679218607&s=luggage&sr=1-8231,,,"₹1,999","₹4,299"
Good Friends Water Resistant School Bag/Backpack/College Bag & Army Digital Watch (Light Blue),bags & luggage,Backpacks,https://m.media-amazon.com/images/I/81fZWGrZ-cL._AC_UL320_.jpg,https://www.amazon.in/Good-Friends-Resistant-Backpack-Watch/dp/B0BXTCPF3D/ref=sr_1_8232?qid=1679218607&s=luggage&sr=1-8232,,,₹799,"₹2,499"
Good Friends Water Resistant School Bag/Backpack/College Bag & Square Analogue Watch (Navy Blue),bags & luggage,Backpacks,https://m.media-amazon.com/images/I/81OymzeXS3L._AC_UL320_.jpg,https://www.amazon.in/Good-Friends-Resistant-Backpack-Watch/dp/B0BXT8K6NX/ref=sr_1_8233?qid=1679218607&s=luggage&sr=1-8233,,,₹749,"₹2,299"
PackBag waterproof college Bag Waterproof school bag Office bag college Backpack (Black),bags & luggage,Backpacks,https://m.media-amazon.com/images/I/31NV4DIRjZL._AC_UL320_.jpg,https://www.amazon.in/PackBag-waterproof-Waterproof-Backpack-Black/dp/B0BXT6QB29/ref=sr_1_8234?qid=1679218607&s=luggage&sr=1-8234,,,₹499,"₹1,199"
Hamy 35 Ltrs Black Casual and Laptop Backpack | Office Bag/School Bag/College Bag/ (Dimensions 18x12),bags & luggage,Backpacks,https://m.media-amazon.com/images/I/61rWOYFiZHL._AC_UL320_.jpg,https://www.amazon.in/Casual-Laptop-Backpack-College-Dimensions/dp/B0BXSX5TMX/ref=sr_1_8235?qid=1679218607&s=luggage&sr=1-8235,,,₹549,"₹1,299"
nubuff backpack,bags & luggage,Backpacks,https://m.media-amazon.com/images/I/719yY0dpP3L._AC_UL320_.jpg,https://www.amazon.in/nubuff-nubuff0010-backpack-tan/dp/B0BXSSJBH7/ref=sr_1_8236?qid=1679218607&s=luggage&sr=1-8236,,,,
Good Friends 40 Ltrs Water Resistant Casual Travel Bagpack/College Backpack/School Office Bag for Men and Women (Green),bags & luggage,Backpacks,https://m.media-amazon.com/images/I/719dD7ehWzL._AC_UL320_.jpg,https://www.amazon.in/Good-Friends-Resistant-Bagpack-Backpack/dp/B0BXSRQX7K/ref=sr_1_8237?qid=1679218607&s=luggage&sr=1-8237,,,₹599,"₹1,799"
Talent BAGS 30 L ‘GALAXY’ Multi-Purpose LIGHT WEIGHT Unisex Style Icon Backpack,bags & luggage,Backpacks,https://m.media-amazon.com/images/I/71k4nPchcWL._AC_UL320_.jpg,https://www.amazon.in/Talent-BAGS-GALAXY-Multi-Purpose-Backpack/dp/B0BXQV6ZGP/ref=sr_1_8238?qid=1679218607&s=luggage&sr=1-8238,,,₹999,"₹1,715"
FunClub Small Bag for Kids Backpack for Kids 3D Cartoon School Bag Toddler Backpack Bag for Girls Hard Shell Backpack for ...,bags & luggage,Backpacks,https://m.media-amazon.com/images/I/61E+zT0pRIL._AC_UL320_.jpg,https://www.amazon.in/Backpack-Hard-Shell-Kindergarten-L-29-5cm/dp/B0BXQ2HXZX/ref=sr_1_8239?qid=1679218607&s=luggage&sr=1-8239,,,₹649,₹899
"FunClub Small Bag for Kids School Backpack for Children School Bag for Student, Bag for Boys Girls Kids, Travel Bag, Picni...",bags & luggage,Backpacks,https://m.media-amazon.com/images/I/712ejq2gNdL._AC_UL320_.jpg,https://www.amazon.in/FunClub-Backpack-Children-Student-L-29-5cm/dp/B0BXQ1LRSB/ref=sr_1_8240?qid=1679218607&s=luggage&sr=1-8240,,,₹649,₹899
"FunClub Small Bag for Kids School Backpack for Children School Bag for Student, Bag for Boys Girls Kids, Travel Bag, Picni...",bags & luggage,Backpacks,https://m.media-amazon.com/images/I/71EgbCUrgaL._AC_UL320_.jpg,https://www.amazon.in/FunClub-Backpack-Children-Student-L-29-5cm/dp/B0BXPZRC2L/ref=sr_1_8241?qid=1679218607&s=luggage&sr=1-8241,,,₹649,₹899
FunClub Small Bag for Kids Backpack for Kids 3D Cartoon School Bag Toddler Backpack Bag for Girls Hard Shell Backpack for ...,bags & luggage,Backpacks,https://m.media-amazon.com/images/I/61M-mum1PEL._AC_UL320_.jpg,https://www.amazon.in/Backpack-Hard-Shell-Kindergarten-L-29-5cm/dp/B0BXPZGWHC/ref=sr_1_8242?qid=1679218607&s=luggage&sr=1-8242,,,₹649,₹899
FunClub Small Bag for Kids Backpack for Kids 3D Cartoon School Bag Toddler Backpack Bag for Girls Hard Shell Backpack for ...,bags & luggage,Backpacks,https://m.media-amazon.com/images/I/517rr7-s14L._AC_UL320_.jpg,https://www.amazon.in/Backpack-Hard-Shell-Kindergarten-L-29-5cm/dp/B0BXPZ7CQH/ref=sr_1_8243?qid=1679218607&s=luggage&sr=1-8243,,,₹649,₹899
FunClub Small Bag for Kids Backpack for Kids 3D Cartoon School Bag Toddler Backpack Bag for Girls Hard Shell Backpack for ...,bags & luggage,Backpacks,https://m.media-amazon.com/images/I/510MPnTtqIL._AC_UL320_.jpg,https://www.amazon.in/Backpack-Hard-Shell-Kindergarten-L-29-5cm/dp/B0BXPYXSV7/ref=sr_1_8244?qid=1679218607&s=luggage&sr=1-8244,,,₹649,₹899
FunClub Small Bag for Kids Backpack for Kids 3D Cartoon School Bag Toddler Backpack Bag for Girls Hard Shell Backpack for ...,bags & luggage,Backpacks,https://m.media-amazon.com/images/I/61TZdJcb16L._AC_UL320_.jpg,https://www.amazon.in/Backpack-Hard-Shell-Kindergarten-L-29-5cm/dp/B0BXPYXR8M/ref=sr_1_8245?qid=1679218607&s=luggage&sr=1-8245,,,₹649,₹899
FunClub Small Bag for Kids Backpack for Kids 3D Cartoon School Bag Toddler Backpack Bag for Girls Hard Shell Backpack for ...,bags & luggage,Backpacks,https://m.media-amazon.com/images/I/51UwnOapbvL._AC_UL320_.jpg,https://www.amazon.in/Backpack-Hard-Shell-Kindergarten-L-29-5cm/dp/B0BXPYS7R4/ref=sr_1_8246?qid=1679218607&s=luggage&sr=1-8246,,,₹649,₹899
"LOADSHARE Backpack for Girls, Teen Backpacks Lightweight Kids Bookbags School Backpack Travel Laptop Backpack Casual Daypa...",bags & luggage,Backpacks,https://m.media-amazon.com/images/I/61RuxKtMh4L._AC_UL320_.jpg,https://www.amazon.in/LOADSHARE-Backpack-Backpacks-Lightweight-Bookbags/dp/B0BXPVDQ4R/ref=sr_1_8247?qid=1679218607&s=luggage&sr=1-8247,,,₹399,₹699
Double Face Mickey And Pooh Bag Soft Material School Bag For Kids Plush Backpack Cartoon Toy | Children's Gifts Boy/Girl/B...,bags & luggage,Backpacks,https://m.media-amazon.com/images/I/81bysCFwnXL._AC_UL320_.jpg,https://www.amazon.in/Material-Backpack-Cartoon-Childrens-Suitable/dp/B0BXPQPPKL/ref=sr_1_8248?qid=1679218607&s=luggage&sr=1-8248,,,₹299,₹699
School and Laptop Backpack With Rain Cover,bags & luggage,Backpacks,https://m.media-amazon.com/images/I/51gKqpq17lL._AC_UL320_.jpg,https://www.amazon.in/School-Laptop-Backpack-Cover-ZZ-02-UNI-BLU-BLACK/dp/B0BXPBB6GV/ref=sr_1_8249?qid=1679218607&s=luggage&sr=1-8249,,,₹649,"₹1,499"
"Torrient Ryden 15.6 Inch laptop bag 20L Waterproof for office,college Multipurpose",bags & luggage,Backpacks,https://m.media-amazon.com/images/I/41oaDZmj8GL._AC_UL320_.jpg,https://www.amazon.in/Torrient-bag-Waterproof-college-Multipurpose/dp/B0BXNRRVX2/ref=sr_1_8250?qid=1679218607&s=luggage&sr=1-8250,,,"₹2,790","₹3,990"
INDIPUNK Kids Donut Bag|Backpack for Kids|Party Bag,bags & luggage,Backpacks,https://m.media-amazon.com/images/I/41x8+v8IBEL._AC_UL320_.jpg,https://www.amazon.in/INDIPUNK-Kids-Donut-Backpack-Party/dp/B0BXMS8L5B/ref=sr_1_8251?qid=1679218607&s=luggage&sr=1-8251,,,₹729,"₹1,299"
Good Friends Water Resistant 40L Laptop Backpack/School Bag//Backpack/College Bag for Men/Women (Black),bags & luggage,Backpacks,https://m.media-amazon.com/images/I/81ZOMA7yzpL._AC_UL320_.jpg,https://www.amazon.in/Good-Friends-Resistant-Backpack-Black/dp/B0BXM2X768/ref=sr_1_8252?qid=1679218607&s=luggage&sr=1-8252,,,₹599,"₹1,799"
Good Friends Water Resistant 40L Laptop Backpack/School Bag//Backpack/College Bag for Men/Women (LIght Blue),bags & luggage,Backpacks,https://m.media-amazon.com/images/I/81f56JJ6XPL._AC_UL320_.jpg,https://www.amazon.in/Good-Friends-Resistant-Backpack-Blue/dp/B0BXM2VC94/ref=sr_1_8253?qid=1679218607&s=luggage&sr=1-8253,,,₹599,"₹1,799"
Half Moon 35L Water Resistant/School Bag/Office Bag/Business Backpack/Daypack for Men and Women,bags & luggage,Backpacks,https://m.media-amazon.com/images/I/61mycT4XEYL._AC_UL320_.jpg,https://www.amazon.in/Half-Moon-Resistant-Business-Backpack/dp/B0BXM1P525/ref=sr_1_8254?qid=1679218607&s=luggage&sr=1-8254,,,₹749,"₹1,999"
EXTREME MACHINE Waterproof Travel Backpack for Hiking Trekking Camping Rucksack with Tourist Mountain Climbing Bag for Men...,bags & luggage,Backpacks,https://m.media-amazon.com/images/I/41XTFW3JrYL._AC_UL320_.jpg,https://www.amazon.in/EXTREME-MACHINE-Waterproof-Army-Printed-Rucksack-Bag/dp/B0BXLT1PPP/ref=sr_1_8255?qid=1679218607&s=luggage&sr=1-8255,,,"₹2,699","₹4,899"
EXTREME MACHINE Waterproof Travel Backpack for Hiking Trekking Camping Rucksack with Tourist Mountain Climbing Bag for Men...,bags & luggage,Backpacks,https://m.media-amazon.com/images/I/31tjNcuQH9L._AC_UL320_.jpg,https://www.amazon.in/EXTREME-MACHINE-Waterproof-Backpack-LBP-35L-BLACK-D1/dp/B0BXLRQ2XY/ref=sr_1_8256?qid=1679218607&s=luggage&sr=1-8256,,,₹699,"₹2,999"
Bag,bags & luggage,Backpacks,https://m.media-amazon.com/images/I/61VSOwQXMWL._AC_UL320_.jpg,https://www.amazon.in/Generic-325685-Bag/dp/B0BVKHRYQ2/ref=sr_1_8689?qid=1679218611&s=luggage&sr=1-8689,,,,
zoraiz Lightweight Laptop Backpack(Black),bags & luggage,Backpacks,https://m.media-amazon.com/images/I/71KVyTEzI6L._AC_UL320_.jpg,https://www.amazon.in/zoraiz-Lightweight-Laptop-Backpack-Black/dp/B0BVKHGDM6/ref=sr_1_8690?qid=1679218611&s=luggage&sr=1-8690,,,₹498,"₹1,099"
Algrowd - PU Leather School Collage Backpack for Girls Large Capicity 40Ltr ( Cream Color ),bags & luggage,Backpacks,https://m.media-amazon.com/images/I/719ObAmtRdL._AC_UL320_.jpg,https://www.amazon.in/Algrowd-Leather-Collage-Backpack-Capicity/dp/B0BVK68MRS/ref=sr_1_8691?qid=1679218611&s=luggage&sr=1-8691,,,,
TRYBAGS Endeavour 45 Ltrs Casual Laptop Backpack,bags & luggage,Backpacks,https://m.media-amazon.com/images/I/81Y-AYBCEKL._AC_UL320_.jpg,https://www.amazon.in/TRYBAGS-Endeavour-Casual-Laptop-Backpack/dp/B0BVK5JKY9/ref=sr_1_8692?qid=1679218611&s=luggage&sr=1-8692,,,"₹1,399","₹3,299"
Algrowd - PU Leather School Collage Backpack for Girls Large Capicity 40Ltr ( Onion Color ),bags & luggage,Backpacks,https://m.media-amazon.com/images/I/81x3a++hC3L._AC_UL320_.jpg,https://www.amazon.in/Algrowd-Leather-Collage-Backpack-Capicity/dp/B0BVK4F593/ref=sr_1_8693?qid=1679218611&s=luggage&sr=1-8693,,,,
CRAYTON Graphical Backpack with Black Combination with Laptop Compartment and Side Pocket Light Weight,bags & luggage,Backpacks,https://m.media-amazon.com/images/I/912YXAS-6bL._AC_UL320_.jpg,https://www.amazon.in/CRAYTON-Marble-design-Backpack-Combination/dp/B0BVJ2VRN2/ref=sr_1_8694?qid=1679218611&s=luggage&sr=1-8694,,,₹749,"₹1,299"
"GOPINATHJI 5 Liter Water Proof Ocean Pack Dry Bag for Travelling,Camping,Hiking, Rafting",bags & luggage,Backpacks,https://m.media-amazon.com/images/I/31UdgnLj0kL._AC_UL320_.jpg,https://www.amazon.in/GOPINATHJI-Travelling-Camping-Hiking-Rafting/dp/B0BVJ2FP29/ref=sr_1_8695?qid=1679218611&s=luggage&sr=1-8695,,,₹399,₹999
TRYBAGS Kidbees Casual Backpack for kids,bags & luggage,Backpacks,https://m.media-amazon.com/images/I/61yT-T3nGGL._AC_UL320_.jpg,https://www.amazon.in/TRYBAGS-Kidbees-Explorer-Casual-Backpack/dp/B0BVJ1YJ4G/ref=sr_1_8696?qid=1679218611&s=luggage&sr=1-8696,,,₹499,"₹1,399"
"CALIST 5L Waterproof Outdoor Ocean Pack Swimming Dry Bag for Travelling,Camping,Hiking, Rafting (Multi Color)",bags & luggage,Backpacks,https://m.media-amazon.com/images/I/31UdgnLj0kL._AC_UL320_.jpg,https://www.amazon.in/CALIST-Waterproof-Outdoor-Swimming-Travelling/dp/B0BVJ1DLWH/ref=sr_1_8697?qid=1679218611&s=luggage&sr=1-8697,,,₹399,₹999
"Sardarji Toys Shop Polyester Printed Casual Backpack for women, 17 inch, Stylish and Trendy College/School Backpack for gi...",bags & luggage,Backpacks,https://m.media-amazon.com/images/I/81fOTZuLXYL._AC_UL320_.jpg,https://www.amazon.in/Sardarji-Polyester-Resistant-Lightweight-compartment/dp/B0BVJ114DT/ref=sr_1_8698?qid=1679218611&s=luggage&sr=1-8698,,,₹899,"₹1,699"
DD RETAILS Stylish Tote Handbags For kids || MultiPurpose Portable Carry Bag || Double Zipper Bag For Women || Shoulder Ba...,bags & luggage,Backpacks,https://m.media-amazon.com/images/I/41h+HyJY08L._AC_UL320_.jpg,https://www.amazon.in/DD-RETAILS-Handbags-MultiPurpose-Multicolor/dp/B0BVHZSYPJ/ref=sr_1_8699?qid=1679218611&s=luggage&sr=1-8699,,,₹248,₹699
CRAYTON Black Backpack with Multiple Pockets,bags & luggage,Backpacks,https://m.media-amazon.com/images/I/817I4SuziEL._AC_UL320_.jpg,https://www.amazon.in/CRAYTON-Black-Backpack-Multiple-Pockets/dp/B0BVHZHHY7/ref=sr_1_8700?qid=1679218611&s=luggage&sr=1-8700,,,₹849,"₹1,499"
"Xporiva Tan Water Resistant Anti Theft 30Liter Capacity Multipurpose Artificial Leather Laptop Backpack Bag, Laptop Bag, C...",bags & luggage,Backpacks,https://m.media-amazon.com/images/I/81Tqsr+S-uL._AC_UL320_.jpg,https://www.amazon.in/Xporiva-Resistant-Multipurpose-Artificial-Backpack/dp/B0BVHZ6QPK/ref=sr_1_8701?qid=1679218611&s=luggage&sr=1-8701,,,₹999,"₹2,500"
Men's School Book Bags Laptop Backpack Travel Rucksack with USB Charge Interface (With Passcode Sequrity),bags & luggage,Backpacks,https://m.media-amazon.com/images/I/61J8MWQ1CKL._AC_UL320_.jpg,https://www.amazon.in/Backpack-Rucksack-Interface-Passcode-Sequrity/dp/B0BVHYGQTL/ref=sr_1_8702?qid=1679218611&s=luggage&sr=1-8702,,,"₹98,499","₹1,94,499"
"Xporiva Black Water Resistant Anti Theft 30Liter Capacity Multipurpose Artificial Leather Laptop Backpack Bag, Laptop Bag,...",bags & luggage,Backpacks,https://m.media-amazon.com/images/I/81SYgoDxoWL._AC_UL320_.jpg,https://www.amazon.in/Xporiva-Resistant-Multipurpose-Artificial-Backpack/dp/B0BVHWH4HC/ref=sr_1_8703?qid=1679218611&s=luggage&sr=1-8703,,,₹999,"₹2,500"
"AIRBAK G-801 Mens & Womens Backpack, 25 Litre Capacity with 15.5 Inch laptop (padded) compartment.",bags & luggage,Backpacks,https://m.media-amazon.com/images/I/71ZSTlPKQSL._AC_UL320_.jpg,https://www.amazon.in/AIRBAK-G-801-Backpack-Capacity-Compartment/dp/B0BVHPMSVN/ref=sr_1_8704?qid=1679218611&s=luggage&sr=1-8704,,,,"₹1,750"
ProArch 10L Backpack Womens Girls Sequins MIni Small Backpack Bag for Girls Womens (Blue),bags & luggage,Backpacks,https://m.media-amazon.com/images/I/51-oJmFHWVL._AC_UL320_.jpg,https://www.amazon.in/ProArch-Backpack-Womens-Girls-Sequins/dp/B0BVGN21H9/ref=sr_1_8705?qid=1679218611&s=luggage&sr=1-8705,,,₹664,"₹2,499"
ProArch Backpack Glitter Womens Girls Sequins MIni Small Backpack Bag for Girls Womens,bags & luggage,Backpacks,https://m.media-amazon.com/images/I/61-99puK1VL._AC_UL320_.jpg,https://www.amazon.in/ProArch-Backpack-Glitter-Womens-Sequins/dp/B0BVGM8F7Q/ref=sr_1_8706?qid=1679218611&s=luggage&sr=1-8706,,,₹664,"₹2,499"
ProArch 10L Backpack Womens Girls Sequins MIni Small Backpack Bag for Girls Womens (Pink),bags & luggage,Backpacks,https://m.media-amazon.com/images/I/710ubN1CBxL._AC_UL320_.jpg,https://www.amazon.in/ProArch-Backpack-Womens-Girls-Sequins/dp/B0BVGKHWQ5/ref=sr_1_8707?qid=1679218611&s=luggage&sr=1-8707,,,₹664,"₹2,499"
"Good Friends Casual School Bag College Backpack, Laptop Bag for Boys and Girls (Black)",bags & luggage,Backpacks,https://m.media-amazon.com/images/I/81Zzr8wUaFL._AC_UL320_.jpg,https://www.amazon.in/Good-Friends-Casual-College-Backpack/dp/B0BVGJFP5V/ref=sr_1_8708?qid=1679218611&s=luggage&sr=1-8708,,,₹549,"₹1,899"
"Skebags Casual Backpack, Water Resistant Travel Bags | for Men and Women Spacious Shoulder Bag for College, Office, Travel...",bags & luggage,Backpacks,https://m.media-amazon.com/images/I/31zzA7sPRQL._AC_UL320_.jpg,https://www.amazon.in/Backpack-Resistant-Spacious-Travelling-Style-001/dp/B0BVGHB532/ref=sr_1_8709?qid=1679218611&s=luggage&sr=1-8709,,,,
Genie Clove Coral in Color Laptop Backpack 19 inch,bags & luggage,Backpacks,https://m.media-amazon.com/images/I/61Ok3P3-XJL._AC_UL320_.jpg,https://www.amazon.in/Genie-Clove-Coral-Laptop-Backpack/dp/B0BVGFPDT1/ref=sr_1_8710?qid=1679218611&s=luggage&sr=1-8710,,,"₹1,732","₹2,665"
"Skebags Casual Backpack, Water Resistant Travel Bags | for Men and Women, Spacious Shoulder Bag for College, Office, Trave...",bags & luggage,Backpacks,https://m.media-amazon.com/images/I/31EB4xMaxJL._AC_UL320_.jpg,https://www.amazon.in/Backpack-Resistant-Spacious-Travelling-Style-001/dp/B0BVGDXTPT/ref=sr_1_8711?qid=1679218611&s=luggage&sr=1-8711,,,,
Trendy Backpack cum Sling bag-Bottle Green,bags & luggage,Backpacks,https://m.media-amazon.com/images/I/41Uh9GHfGNL._AC_UL320_.jpg,https://www.amazon.in/Trendy-Backpack-Sling-bag-Bottle-Green/dp/B0BVGCHPGQ/ref=sr_1_8712?qid=1679218611&s=luggage&sr=1-8712,,,₹499,₹635
